{
  "schemaVersion": 1,
  "sourceDigest": "sha256:277d0480b0704d6d17599a4a07c89570f4bda43dd624fc3ea3b72479f634952b",
  "generator": "npm run sites:generate",
  "kind": "diving-simulator-site-presentation",
  "sites": {
    "shore": {
      "id": "shore",
      "name": "Shore",
      "surfaceMarker": "buoy",
      "features": [
        {
          "kind": "buoy",
          "x": 0
        },
        {
          "kind": "towel",
          "x": -17
        },
        {
          "kind": "umbrella",
          "x": -13
        },
        {
          "kind": "towel",
          "x": -6
        },
        {
          "kind": "seagrass",
          "x": 18,
          "d": 5
        },
        {
          "kind": "seagrass",
          "x": 25,
          "d": 6
        },
        {
          "kind": "seagrass",
          "x": 32,
          "d": 6
        },
        {
          "kind": "seagrass",
          "x": 45,
          "d": 8
        },
        {
          "kind": "seagrass",
          "x": 52,
          "d": 8
        },
        {
          "kind": "seagrass",
          "x": 60,
          "d": 9
        },
        {
          "kind": "seagrass",
          "x": 68,
          "d": 10
        },
        {
          "kind": "seagrass",
          "x": 78,
          "d": 11
        },
        {
          "kind": "seagrass",
          "x": 82,
          "d": 12
        },
        {
          "kind": "seagrass",
          "x": 86,
          "d": 13
        },
        {
          "kind": "coral",
          "x": 85,
          "d": 13
        },
        {
          "kind": "coral",
          "x": 90,
          "d": 13
        },
        {
          "kind": "coral",
          "x": 152,
          "d": 28
        },
        {
          "kind": "anchor",
          "x": 156
        },
        {
          "kind": "seagrass",
          "x": 159,
          "d": 29
        },
        {
          "kind": "seagrass",
          "x": 163,
          "d": 29
        },
        {
          "kind": "seagrass",
          "x": 168,
          "d": 29
        },
        {
          "kind": "coral",
          "x": 180,
          "d": 30
        }
      ],
      "visualZones": [
        {
          "id": "shore_entry",
          "x1": -20,
          "x2": 25,
          "d1": 0,
          "d2": 4,
          "priority": 10,
          "blend": 1,
          "tags": [
            "shore",
            "sand",
            "sunlit",
            "shallow"
          ]
        },
        {
          "id": "shore_grass",
          "x1": 10,
          "x2": 88,
          "d1": 3,
          "d2": 13,
          "priority": 10,
          "blend": 2,
          "tags": [
            "shore",
            "sand",
            "seagrass",
            "shallow"
          ]
        },
        {
          "id": "shore_slope",
          "x1": 55,
          "x2": 118,
          "d1": 10,
          "d2": 22,
          "priority": 8,
          "blend": 2,
          "tags": [
            "shore",
            "sand",
            "slope"
          ]
        },
        {
          "id": "shore_boulder_gate",
          "x1": 95,
          "x2": 134,
          "d1": 12,
          "d2": 22,
          "priority": 14,
          "blend": 2,
          "tags": [
            "shore",
            "sand",
            "boulder-gate",
            "transition"
          ]
        },
        {
          "id": "shore_deep",
          "x1": 90,
          "x2": 190,
          "d1": 18,
          "d2": 32,
          "priority": 12,
          "blend": 2,
          "tags": [
            "shore",
            "sand",
            "deep",
            "wreck-debris"
          ]
        }
      ],
      "atmosphereProfiles": {
        "shore_entry": {
          "visibility": 1.1,
          "tint": [
            1,
            1.05,
            0.98
          ],
          "particleDensity": 1.1,
          "particleBrightness": 1.15,
          "ambient": 1.15
        },
        "shore_grass": {
          "visibility": 0.95,
          "tint": [
            0.98,
            1.02,
            0.98
          ],
          "particleDensity": 1.25,
          "particleBrightness": 1,
          "ambient": 1
        },
        "shore_slope": {
          "visibility": 1,
          "tint": [
            1,
            1,
            1
          ],
          "particleDensity": 1,
          "particleBrightness": 1,
          "ambient": 0.95
        },
        "shore_boulder_gate": {
          "visibility": 0.98,
          "tint": [
            1.02,
            0.98,
            0.94
          ],
          "particleDensity": 1.05,
          "particleBrightness": 0.95,
          "ambient": 0.92
        },
        "shore_deep": {
          "visibility": 0.85,
          "tint": [
            0.9,
            0.95,
            1
          ],
          "particleDensity": 0.9,
          "particleBrightness": 0.8,
          "ambient": 0.8
        }
      },
      "decorationRules": [
        {
          "id": "shore_entry_shells",
          "zone": "shore_entry",
          "spacing": 1.9,
          "density": 0.6,
          "seed": 1101,
          "surface": "floor",
          "props": [
            {
              "kind": "shell",
              "weight": 2
            },
            {
              "kind": "pebble",
              "weight": 3
            },
            {
              "kind": "smallRock",
              "weight": 1
            }
          ]
        },
        {
          "id": "shore_grass_micro",
          "zone": "shore_grass",
          "spacing": 1.4,
          "density": 0.85,
          "seed": 1102,
          "surface": "floor",
          "props": [
            {
              "kind": "grassTuft",
              "weight": 3
            },
            {
              "kind": "pebble",
              "weight": 4
            },
            {
              "kind": "sandRippleAccent",
              "weight": 2
            }
          ]
        },
        {
          "id": "shore_boulder_gate_stones",
          "zone": "shore_boulder_gate",
          "spacing": 1.8,
          "density": 0.6,
          "seed": 1104,
          "surface": "floor",
          "props": [
            {
              "kind": "smallRock",
              "weight": 4
            },
            {
              "kind": "pebble",
              "weight": 3
            },
            {
              "kind": "debrisSpeck",
              "weight": 1
            }
          ]
        },
        {
          "id": "shore_deep_debris",
          "zone": "shore_deep",
          "spacing": 2.5,
          "density": 0.45,
          "seed": 1103,
          "surface": "floor",
          "props": [
            {
              "kind": "smallRock",
              "weight": 3
            },
            {
              "kind": "pebble",
              "weight": 2
            },
            {
              "kind": "debrisSpeck",
              "weight": 2
            }
          ]
        }
      ]
    },
    "reef": {
      "id": "reef",
      "name": "Reef",
      "surfaceMarker": "boat",
      "features": [
        {
          "kind": "tableCoral",
          "x": -4,
          "d": 5
        },
        {
          "kind": "tableCoral",
          "x": 2,
          "d": 5
        },
        {
          "kind": "brainCoral",
          "x": 5,
          "d": 5
        },
        {
          "kind": "brainCoral",
          "x": 6,
          "d": 5
        },
        {
          "kind": "staghorn",
          "x": -2,
          "d": 5
        },
        {
          "kind": "staghorn",
          "x": 1,
          "d": 5
        },
        {
          "kind": "softCoral",
          "x": -6,
          "d": 5,
          "color": "#c84a8a"
        },
        {
          "kind": "softCoral",
          "x": 7,
          "d": 5,
          "color": "#e8839a"
        },
        {
          "kind": "anthiasCloud",
          "x": 0,
          "d": 3,
          "w": 240,
          "h": 90,
          "count": 70,
          "dir": 1
        },
        {
          "kind": "softCoral",
          "x": 10,
          "d": 18,
          "color": "#e8839a"
        },
        {
          "kind": "softCoral",
          "x": -10,
          "d": 18,
          "color": "#c84a8a"
        },
        {
          "kind": "gorgonian",
          "x": 11,
          "d": 24,
          "side": "right",
          "color": "#c83a5a"
        },
        {
          "kind": "gorgonian",
          "x": -11,
          "d": 24,
          "side": "left",
          "color": "#a83a4a"
        },
        {
          "kind": "brainCoral",
          "x": -10.5,
          "d": 21
        },
        {
          "kind": "barrelSponge",
          "x": 12,
          "d": 30,
          "color": "#9c5a3a"
        },
        {
          "kind": "barrelSponge",
          "x": -12,
          "d": 30,
          "color": "#8a4828"
        },
        {
          "kind": "gorgonian",
          "x": 14,
          "d": 32,
          "side": "right",
          "color": "#d84a6a",
          "scale": 2.15
        },
        {
          "kind": "gorgonian",
          "x": 13,
          "d": 37,
          "side": "right",
          "color": "#c83a5a"
        },
        {
          "kind": "gorgonian",
          "x": -13,
          "d": 37,
          "side": "left",
          "color": "#882a3a"
        },
        {
          "kind": "softCoral",
          "x": 15,
          "d": 52,
          "color": "#7a4a8a"
        },
        {
          "kind": "anthiasCloud",
          "x": -17,
          "d": 45,
          "w": 200,
          "h": 130,
          "count": 80,
          "dir": 1
        },
        {
          "kind": "gorgonian",
          "x": 16,
          "d": 60,
          "side": "right",
          "color": "#882a3a"
        },
        {
          "kind": "softCoral",
          "x": -16,
          "d": 60,
          "color": "#7a4a8a"
        },
        {
          "kind": "gorgonian",
          "x": -18,
          "d": 78,